source|date|line_1|line_2|line_3
GPT|2025-04-01T12:17:11.816423|Whispers of the breeze,|Cherry blossoms dance and swirl,|Spring's soft breath awakes.
Anthropic|2025-04-01T12:17:13.689200|Soft cherry blossoms|Dancing on gentle spring breeze|Whisper nature's song
Gemini|2025-04-01T12:17:14.386339|Green leaves gently sway,|Sunlight paints the world anew,|Summer softly sighs.
GPT|2025-04-01T12:18:00.371575|Whispers in the breeze,|Autumn leaves dance to the ground,|Nature's soft farewell.
Anthropic|2025-04-01T12:18:02.248073|Soft petals dancing|Whispers of spring breeze caress|Blossoms gently sway
Gemini|2025-04-01T12:18:02.980340|Green leaves softly sway,|Sunlight paints the forest floor,|Peaceful, gentle breeze.
GPT|2025-04-01T12:18:18.490201|Whispers of the stream,|Moonlight dances on the leaves,|Night breathes soft and calm.
Anthropic|2025-04-01T12:18:19.768244|Soft petals whisper|Moonlight dances on the lake|Silence blooms like dawn
Gemini|2025-04-01T12:18:20.420162|Green leaves softly sway,|Sunlight paints the gentle breeze,|Summer's sweet perfume.
GPT|2025-04-01T12:19:56.590908|Whispers of the breeze,|Cherry blossoms gently fall,|Spring's breath softly sighs.
Anthropic|2025-04-01T12:19:58.865470|Soft petals dance down|Whispers of spring's gentle breath|Painting earth with hope
Gemini|2025-04-01T12:19:59.565239|Green leaves softly fall,|Whispering winds through the trees,|Winter's cold arrives.
GPT|2025-04-05T11:47:55.558291|Whispers in the breeze,|Cherry blossoms gently fall,|Spring's soft, fleeting kiss.
Anthropic|2025-04-05T11:47:57.207767|Soft petals dancing|Whispers of spring's gentle breeze|Nature awakens
Gemini|2025-04-05T11:47:57.734474|Green leaves softly sway,|Sunlight paints the forest floor,|Peace in gentle breeze.
GPT|2025-04-05T11:59:55.039689|Gentle autumn breeze,|Leaves whispering their goodbyes,|Nature's calm embrace.
Anthropic|2025-04-05T11:59:56.248267|Soft petals dancing|Whispers of spring's gentle breeze|Nature awakens
Gemini|2025-04-05T11:59:56.829037|Green leaves softly sway,|Sunlight paints the forest floor,|Peace fills the warm air.
GPT|2025-04-08T12:51:12.118845|Whispers in the breeze,|Golden leaves dance to the ground,|Autumn's soft embrace.
Anthropic|2025-04-08T12:51:12.118845|Soft moonlight whispers|Gentle breezes dance through trees|Silent night descends
Gemini|2025-04-08T12:51:12.118845|Green leaves softly sway,|Gentle breeze begins to blow,|Summer's sweet perfume.
GPT|2025-04-08T12:53:12.788437|City lights gleam bright|Echoes of laughter resound|Night's pulse throbs with hope
Anthropic|2025-04-08T12:53:12.788437|City lights flicker|Subway rumbles beneath streets|Dreams pulse electric
Gemini|2025-04-08T12:53:12.788437|Code compiles fast now|The logic flows so well,|Success is so near.
GPT|2025-04-08T12:53:31.152506|Whispers in the night,|Stars twinkle in silence bright,|Dreams take graceful flight.
Anthropic|2025-04-08T12:53:31.152506|Moonlight on water|Ripples dance like silver threads|Soft night whispers calm
Gemini|2025-04-08T12:53:31.152506|Green leaves softly sway|Gentle breeze begins to blow,|Summer's sweet perfume.
GPT|2025-04-08T12:54:18.651517|City streets hustle,|Voices blend, a vibrant pulse,|Hope ignites the grey.
Anthropic|2025-04-08T12:54:18.651517|Copper pots gleaming|Kitchen whispers secrets soft|Culinary art
Gemini|2025-04-08T12:54:18.651517|Green leaves softly sway|Summer breeze begins to blow,|Warm sun starts to gleam.
GPT|2025-04-08T12:55:55.523447|Whispers in the dusk,|Shadows dance upon the ground,|Night's gentle embrace.
Anthropic|2025-04-08T12:55:55.523447|Soft moonlight whispers|Gentle breeze caresses leaves|Midnight's silent song
Gemini|2025-04-08T12:55:55.523447|Green leaves softly sway|Gentle breeze whispers by now|Nature's sweet embrace
GPT|2025-04-08T12:56:07.671449|Racing thoughts collide,|In the chaos of the day,|Dreams unfold in noise.
Anthropic|2025-04-08T12:56:07.671449|Bustling city street|Horns blare, footsteps rush and dance|Urban pulse thrums loud
Gemini|2025-04-08T12:56:07.671449|Code compiles fast now|Bugs still hide in the dark|Testing will find them
GPT|2025-04-08T13:15:56.406775|Stars twinkle above,|Dreams weave through the silent sky,|Hope shines like their light.
Anthropic|2025-04-08T13:15:56.406775|Rusty gears turning|Ancient factory echoes loud|Memories grind on
Gemini|2025-04-08T13:15:56.406775|Bright sun in the sky|Birds are singing their sweet song|Warm summer is here
GPT|2025-04-08T13:18:08.625290|Frost on frozen glass|Footprints mark the silent earth|Winter's breath lingers
Anthropic|2025-04-08T13:18:08.625290|Rusty gears spinning|Machines dance with scattered rust|Metal echoes loud
Gemini|2025-04-08T13:18:08.625290|Old book's paper scent,|Dust motes dance in sun's bright ray,|Stories softly wait.
GPT|2025-04-08T13:19:20.921951|Whispers in the breeze,|Leaves dance under a pale moon,|Night's soft lullaby.
Anthropic|2025-04-08T13:19:20.921951|Moonlight on river|Silver ripples dance and sway|Soft whispers of night
Gemini|2025-04-08T13:19:20.921951|Green leaves softly sway|Gentle breeze whispers tales|Nature's sweet embrace
GPT|2025-04-11T12:57:18.168218|Chasing distant dreams,|Echoes of the bustling world,|Voices rise and fall.
Anthropic|2025-04-11T12:57:18.168218|Rusty gears turning|Factory echoes with rhythm|Machines pulse with life
Gemini|2025-04-11T12:57:18.168218|Code compiles now fast|No more errors appear,|Success fills my screen.
GPT|2025-04-11T12:58:13.591355|In the quiet room,|thoughts weave through unspoken minds,|breath holds the still pulse.
Anthropic|2025-04-11T12:58:13.591355|Lovers' hands entwined|Whispers of passion softly dance|Hearts beat as one flame
Gemini|2025-04-11T12:58:13.591355|Empty room awaits|A forgotten story told|Silence starts to bloom
GPT|2025-04-11T13:00:08.069232|Eyes open, searching|Amidst the crowded journey|Voices blend, unheard
Anthropic|2025-04-11T13:00:08.069232|Spices dance and swirl|Saffron threads weave through warm broth|Flavors bloom with fire
Gemini|2025-04-11T13:00:08.069232|Cold wind starts to blow|Empty streets begin to fill|New shops open doors
GPT|2025-04-11T13:03:37.046889|Morning dew glistens,|Whispers of the waking sun,|Nature's breath begins.
Anthropic|2025-04-11T13:03:37.046889|Soft moss whispers low|Sunlight dapples forest floor|Gentle winds caress
Gemini|2025-04-11T13:03:37.046889|Green leaves softly sway|Gentle breeze begins to blow,|Summer days arrive
GPT|2025-04-15T12:08:15.762719|Whispers on the breeze,|Chasing shadows of the past,|Time moves like a stream.
Anthropic|2025-04-15T12:08:15.762719|Steel towers gleaming|Machines hum electric dreams|Cities pulse with light
Gemini|2025-04-15T12:08:15.762719|Code compiles quick now|Bugs are squashed, the program runs,|Software is done.
GPT|2025-04-15T12:10:52.650079|Silent shadows dance,|whispers of forgotten dreams,|echoes in the night.
Anthropic|2025-04-15T12:10:52.650079|Moonlight on water|Silver ripples dance and gleam bright|Shadows softly drift
Gemini|2025-04-15T12:10:52.650079|Metal bird takes flight,|Soaring through the wide blue,|Clouds drift far below.
GPT|2025-04-15T12:16:53.958531|A candle flickers,|Shadows dance on hollow walls,|Memories linger.
Anthropic|2025-04-15T12:16:53.958531|Rusty gears grind slow|Factory echoes with rhythms|Workers' hands weave fate
Gemini|2025-04-15T12:16:53.958531|A quick, cold shower,|Wakes the mind and body up,|Ready for the day.
