source|date|line_1|line_2|line_3
GPT|2025-04-01T12:17:11.816423|Whispers of the breeze,|Cherry blossoms dance and swirl,|Spring's soft breath awakes.
Anthropic|2025-04-01T12:17:13.689200|Soft cherry blossoms|Dancing on gentle spring breeze|Whisper nature's song
Gemini|2025-04-01T12:17:14.386339|Green leaves gently sway,|Sunlight paints the world anew,|Summer softly sighs.
GPT|2025-04-01T12:18:00.371575|Whispers in the breeze,|Autumn leaves dance to the ground,|Nature's soft farewell.
Anthropic|2025-04-01T12:18:02.248073|Soft petals dancing|Whispers of spring breeze caress|Blossoms gently sway
Gemini|2025-04-01T12:18:02.980340|Green leaves softly sway,|Sunlight paints the forest floor,|Peaceful, gentle breeze.
GPT|2025-04-01T12:18:18.490201|Whispers of the stream,|Moonlight dances on the leaves,|Night breathes soft and calm.
Anthropic|2025-04-01T12:18:19.768244|Soft petals whisper|Moonlight dances on the lake|Silence blooms like dawn
Gemini|2025-04-01T12:18:20.420162|Green leaves softly sway,|Sunlight paints the gentle breeze,|Summer's sweet perfume.
GPT|2025-04-01T12:19:56.590908|Whispers of the breeze,|Cherry blossoms gently fall,|Spring's breath softly sighs.
Anthropic|2025-04-01T12:19:58.865470|Soft petals dance down|Whispers of spring's gentle breath|Painting earth with hope
Gemini|2025-04-01T12:19:59.565239|Green leaves softly fall,|Whispering winds through the trees,|Winter's cold arrives.
GPT|2025-04-05T11:47:55.558291|Whispers in the breeze,|Cherry blossoms gently fall,|Spring's soft, fleeting kiss.
Anthropic|2025-04-05T11:47:57.207767|Soft petals dancing|Whispers of spring's gentle breeze|Nature awakens
Gemini|2025-04-05T11:47:57.734474|Green leaves softly sway,|Sunlight paints the forest floor,|Peace in gentle breeze.
GPT|2025-04-05T11:59:55.039689|Gentle autumn breeze,|Leaves whispering their goodbyes,|Nature's calm embrace.
Anthropic|2025-04-05T11:59:56.248267|Soft petals dancing|Whispers of spring's gentle breeze|Nature awakens
Gemini|2025-04-05T11:59:56.829037|Green leaves softly sway,|Sunlight paints the forest floor,|Peace fills the warm air.
